{
  "$schema": "../schema/digital-identity.schema.json",
  "schema_version": "1.0.0",
  "generated_at": "2026-06-06T01:46:34.355Z",
  "source_priority": [
    "docs/master.md",
    "docs/padpod_documentacao.docx.md",
    "docs/branding/00 — Cross-Brand System/*",
    "docs/branding/{brand}/01 — Brand Bible.md",
    "docs/branding/{brand}/02 — Site Blueprint.md",
    "docs/data/index/codeloop-brands/data/brands.js",
    "docs/data/{slug}/config.json",
    "docs/data/{slug}/worktree.json",
    "docs/data/{slug}/gaps.json",
    "docs/data/{slug}/assets/logos/*",
    "docs/data/audit/knowledge-index.json",
    "docs/data/audit/enrichment-preview/{slug}.json"
  ],
  "source_manifest": {
    "priority_order": [
      "docs/master.md",
      "docs/padpod_documentacao.docx.md",
      "docs/branding/00 — Cross-Brand System/*",
      "docs/branding/{brand}/01 — Brand Bible.md",
      "docs/branding/{brand}/02 — Site Blueprint.md",
      "docs/data/index/codeloop-brands/data/brands.js",
      "docs/data/{slug}/config.json",
      "docs/data/{slug}/worktree.json",
      "docs/data/{slug}/gaps.json",
      "docs/data/{slug}/assets/logos/*",
      "docs/data/audit/knowledge-index.json",
      "docs/data/audit/enrichment-preview/{slug}.json"
    ],
    "kb_coverage": "none",
    "sources": [
      {
        "type": "schema",
        "path": "docs/master.md",
        "priority": 1
      },
      {
        "type": "architecture",
        "path": "docs/padpod_documentacao.docx.md",
        "priority": 1
      },
      {
        "type": "cross_brand",
        "path": "docs/branding/00 — Cross-Brand System/01 — Master Brand System.md",
        "priority": 2
      },
      {
        "type": "cross_brand",
        "path": "docs/branding/00 — Cross-Brand System/02 — The Loop — Canonical User Journey.md",
        "priority": 2
      },
      {
        "type": "cross_brand",
        "path": "docs/branding/00 — Cross-Brand System/03 — Glossary & Canonical Definitions.md",
        "priority": 2
      },
      {
        "type": "cross_brand",
        "path": "docs/branding/00 — Cross-Brand System/04 — Asset Production Standards.md",
        "priority": 2
      },
      {
        "type": "brand_tokens",
        "path": "docs/data/index/codeloop-brands/data/brands.js",
        "priority": 4
      },
      {
        "type": "config",
        "path": "docs/data/karonlabs/config.json",
        "priority": 5
      },
      {
        "type": "worktree",
        "path": "docs/data/karonlabs/worktree.json",
        "priority": 5
      },
      {
        "type": "gaps",
        "path": "docs/data/karonlabs/gaps.json",
        "priority": 5
      },
      {
        "type": "knowledge_index",
        "path": "docs/data/audit/knowledge-index.json",
        "priority": 6
      },
      {
        "type": "enrichment_preview",
        "path": "docs/data/audit/enrichment-preview/karonlabs.json",
        "priority": 6
      }
    ]
  },
  "digital_identity": {
    "id": "identity-karonlabs",
    "slug": "karonlabs",
    "name": "Karon Labs",
    "legal_name": null,
    "type": "company",
    "status": "active",
    "parent_identity_id": "identity-ecosystem",
    "ecosystem": "Karon",
    "description": "Innovation and research arm of the Karon Group — a CodeLoop Ecosystem Partner.",
    "mission": "To make Karon Labs a governed, traceable, and expressive digital identity across web, content, assets, and operations.",
    "vision": null,
    "values": [
      {
        "id": "value-karonlabs-1",
        "title": "Operational clarity",
        "description": "Karon Labs should make decisions, ownership, and next actions legible across the identity."
      },
      {
        "id": "value-karonlabs-2",
        "title": "Governed originality",
        "description": "Every strong claim must remain traceable to source material, confidence, and review status."
      },
      {
        "id": "value-karonlabs-3",
        "title": "Portable execution",
        "description": "Every web section is structured as a reusable PAD/POD unit that can move across surfaces."
      }
    ],
    "positioning": {
      "category": "company",
      "market": "Digital identity and web operating infrastructure",
      "statement": null,
      "differentiators": [],
      "competitors": [],
      "anti_positioning": []
    },
    "brand_voice": {
      "primary": "institutional",
      "secondary": "strategic",
      "avoid": [
        "empty hype",
        "untraceable claims"
      ]
    },
    "created_at": "2026-06-06T01:46:34.355Z",
    "updated_at": "2026-06-06T01:46:34.355Z"
  },
  "brand_core": {
    "identity_id": "identity-karonlabs",
    "brand_name": "Karon Labs",
    "tagline": "Innovation and research arm of the Karon Group — a CodeLoop Ecosystem Partner.",
    "short_description": "Innovation and research arm of the Karon Group — a CodeLoop Ecosystem Partner.",
    "long_description": "Innovation and research arm of the Karon Group — a CodeLoop Ecosystem Partner.",
    "mission": "To make Karon Labs a governed, traceable, and expressive digital identity across web, content, assets, and operations.",
    "vision": null,
    "values": [
      {
        "id": "value-karonlabs-1",
        "title": "Operational clarity",
        "description": "Karon Labs should make decisions, ownership, and next actions legible across the identity."
      },
      {
        "id": "value-karonlabs-2",
        "title": "Governed originality",
        "description": "Every strong claim must remain traceable to source material, confidence, and review status."
      },
      {
        "id": "value-karonlabs-3",
        "title": "Portable execution",
        "description": "Every web section is structured as a reusable PAD/POD unit that can move across surfaces."
      }
    ],
    "positioning": {
      "category": "company",
      "market": "Digital identity and web operating infrastructure",
      "statement": null,
      "differentiators": [],
      "competitors": [],
      "anti_positioning": []
    },
    "narrative": {
      "origin_story": "",
      "founder_message": null,
      "manifesto": null,
      "elevator_pitch": "Karon Labs: Innovation and research arm of the Karon Group — a CodeLoop Ecosystem Partner.",
      "one_liner": "Innovation and research arm of the Karon Group — a CodeLoop Ecosystem Partner."
    },
    "source_meta": {
      "state": "generated",
      "confidence": "low",
      "source_refs": [
        "docs/master.md",
        "docs/padpod_documentacao.docx.md",
        "docs/data/index/codeloop-brands/data/brands.js",
        "docs/data/karonlabs/config.json",
        "docs/data/karonlabs/worktree.json",
        "docs/data/karonlabs/gaps.json"
      ],
      "generation_reason": "fallback identity synthesis from config, worktree, and available brand tokens",
      "review_required": true,
      "visibility": "public"
    }
  },
  "brand_voice": {
    "identity_id": "identity-karonlabs",
    "language_default": "en-US",
    "supported_languages": [
      "en-US",
      "pt-BR",
      "es-ES"
    ],
    "tone": {
      "primary": "institutional",
      "secondary": "strategic",
      "avoid": [
        "empty hype",
        "untraceable claims"
      ]
    },
    "style": {
      "sentence_length": "medium",
      "technical_depth": "medium",
      "formality": "premium",
      "emotional_intensity": "controlled"
    },
    "vocabulary": {
      "preferred_terms": [
        "Dynamic Work",
        "Augmented Intelligence"
      ],
      "blocked_terms": [
        "cheap",
        "generic"
      ],
      "canonical_terms": {
        "AI": "Augmented Intelligence",
        "workers": "Loopers",
        "companies": "Partners",
        "initiative": "Endeavor"
      }
    },
    "copy_rules": {
      "cta_style": "action-oriented",
      "headline_style": "specific, concrete, and brand-modulated",
      "description_style": "clear, strategic, concrete, source-traceable",
      "voice_principles": []
    },
    "source_meta": {
      "state": "generated",
      "confidence": "low",
      "source_refs": [
        "docs/master.md",
        "docs/padpod_documentacao.docx.md",
        "docs/data/index/codeloop-brands/data/brands.js",
        "docs/data/karonlabs/config.json",
        "docs/data/karonlabs/worktree.json",
        "docs/data/karonlabs/gaps.json"
      ],
      "generation_reason": "voice rails inherited from cross-brand rules and modulated by available brand sources",
      "review_required": true,
      "visibility": "public"
    }
  },
  "design_system": {
    "identity_id": "identity-karonlabs",
    "theme": {
      "mode": "light",
      "variant": "dark-tech",
      "palette": {
        "bg": "#060914",
        "bg_light": "#0d1530",
        "primary": "#6366f1",
        "primary_light": "#818cf8",
        "secondary": "#06b6d4",
        "accent": "#f59e0b",
        "text": "#e2e8f0",
        "text_muted": "#8b96b8",
        "border": "rgba(99,102,241,0.2)",
        "gradient": "linear-gradient(135deg, #6366f1 0%, #06b6d4 100%)"
      },
      "scale": [],
      "semantics": {}
    },
    "typography": {
      "heading": "Sora",
      "body": "Sora",
      "display": "Sora",
      "mono": "Inter",
      "google_fonts_url": "https://fonts.googleapis.com/css2?family=Fira+Code:wght@400;500&family=Instrument+Serif:ital@0;1&family=Sora:wght@300;400;500;600;700&display=swap"
    },
    "layout": {
      "container_max_width": "1200px",
      "grid_columns": 12,
      "spacing_scale": [
        4,
        8,
        12,
        16,
        24,
        32,
        48,
        64,
        96
      ],
      "radius_scale": {
        "sm": "4px",
        "md": "8px",
        "lg": "16px",
        "xl": "32px"
      }
    },
    "motion": {
      "default_duration": 0.8,
      "easing": "power3.out",
      "library": "gsap",
      "reduced_motion_fallback": true,
      "brand_art_type": null
    }
  },
  "brand_assets": {